{
  "recordId": "demo-invoice-0001",
  "datasetVersion": "v1",
  "image": {
    "uri": "private://training/invoices/demo-invoice-0001.jpg",
    "mimeType": "image/jpeg"
  },
  "split": "train",
  "source": {
    "layoutId": "demo-pharmacy-layout-01",
    "captureType": "camera",
    "supplierLabel": "synthetic-demo"
  },
  "quality": {
    "humanVerified": true,
    "allStockRowsChecked": true,
    "passedQualityGate": true,
    "notes": "Synthetic example only."
  },
  "items": [
    {
      "rowId": 1,
      "productName": "DEMO TABLET 500 MG",
      "batchNumber": "DEMO001",
      "expiryDate": "2028-05-31",
      "quantity": 3,
      "fieldReview": {
        "productName": "verified",
        "batchNumber": "verified",
        "expiryDate": "corrected",
        "quantity": "verified"
      }
    },
    {
      "rowId": 2,
      "productName": "DEMO CAPSULE 10 MG",
      "batchNumber": "DEMO002",
      "expiryDate": "2029-06-30",
      "quantity": 2,
      "fieldReview": {
        "productName": "verified",
        "batchNumber": "verified",
        "expiryDate": "verified",
        "quantity": "verified"
      }
    }
  ]
}
